{
  "schema_version": 1,
  "comment": "The machine-readable exclusion ledger (V-020). Every entry is one thing this project does not check, with the reason, the specification basis (or an explicit statement that none applies), what covers the behaviour instead (naming a case or checker that exists and passes, or explicitly nothing), the cases and fields affected, and what would let the exclusion be removed. tools/check_exclusions.py validates this file against config/schema/exclusion_ledger.schema.json, refuses any registered case that has no recorded PASS unless it is named here, refuses an alternative verification that names a case which does not exist or does not pass, and refuses an empty end condition. The rule the ledger exists to enforce: an exclusion that is not written here is an unregistered exclusion, and an unregistered exclusion is a failure, not a footnote.",
  "kind_semantics": {
    "disabled_checker": "A checker, lint pass or gate that is switched off or short-circuited for some inputs. The check exists but does not run for the named subjects.",
    "skip": "A case, suite, phase, profile, seed or stimulus that is not run. The check exists and would run; the input is withheld.",
    "waiver": "A comparison that is deliberately not made for a named field, output or word, so a difference there cannot fail the run. A waiver must name independent verification that passes; a waiver that synchronises the DUT to the reference and thereby removes the independent check is the failure mode this kind exists to forbid.",
    "unimplemented_reference_feature": "A feature the DUT or a reference model does not implement, so the comparison either cannot be made or is made against a weaker oracle. Named per model and per feature.",
    "timeout": "A wall-clock or cycle budget that ends a run and stands in for a verdict. A timeout that is reported as FAIL is honest; one that is reported as PASS or silently skipped is not.",
    "generation_failure": "A step that produces the tests themselves (ELF generation, manifest generation, test selection) and can drop a test from the total. The end condition for this kind is that the count is closed against the generation manifest."
  },
  "exclusions": [
    {
      "id": "EX-001",
      "kind": "disabled_checker",
      "subjects": [
        "C++ sources whose Vmosaic_*_tb.h has not been generated yet",
        "sim/unit/tb_fifo.cpp (the observed instance)"
      ],
      "reason": "make lint-cpp compiles every sim/**/*.cpp with -Ibuild/<profile>/unit/*/obj_dir on the include path. A driver includes the Verilator-generated header for its own testbench, and that header exists only after the corresponding unit case has been built. On a partially-built tree the compile fails with a missing header that says nothing about the C++.",
      "spec_clause": "No ISA clause applies: this is a build-ordering property of the Verilator flow, not a specification requirement.",
      "alternative_verification": {
        "status": "covered",
        "cases": [
          "fifo.backpressure"
        ],
        "checks": [
          "tools/run_unit.py"
        ],
        "note": "The file that is skipped is compiled by the case that owns it: fifo.backpressure builds sim/unit/tb_fifo.cpp and passes. make test orders unit before lint-cpp, so in the gate nothing is skipped; the residual risk is a direct `make lint-cpp` on a clean tree."
      },
      "affected_cases": [
        {
          "case": "fifo.backpressure",
          "fields": [
            "cpp"
          ]
        }
      ],
      "affected_scope": "Makefile lint-cpp target; sim/unit/*.cpp",
      "end_condition": "Every case's generated header exists before lint-cpp runs (a build-everything step, or lint-cpp depending on unit), so the skip branch never fires and the skipped count printed by the target is always zero."
    },
    {
      "id": "EX-002",
      "kind": "disabled_checker",
      "subjects": [
        "any rtl/ source with neither a module nor a package"
      ],
      "reason": "tools/lint_rtl.py returns \"no module or package; skipped\" for a file that declares neither, because there is nothing for Verilator to elaborate standalone. A file that is only an include fragment would pass lint without being linted.",
      "spec_clause": "No ISA clause applies: this is a property of the lint harness, not of the design.",
      "alternative_verification": {
        "status": "open",
        "cases": [],
        "checks": [],
        "note": "Nothing covers it. No file under rtl/ lacks both a module and a package today, so the branch is dormant; the exclusion is recorded so that if one is added it is a named gap rather than an invisible one."
      },
      "affected_cases": [],
      "affected_scope": "tools/lint_rtl.py; rtl/**",
      "end_condition": "The skip branch is deleted or turned into a hard failure (a file with neither construct is not RTL and should not be in rtl/), at which point a dormant exclusion becomes a real check."
    },
    {
      "id": "EX-003",
      "kind": "disabled_checker",
      "subjects": [
        "make synth-generic",
        "tools/synth_check.py",
        "whole-design Yosys synthesis"
      ],
      "reason": "Yosys 0.69 cannot parse SystemVerilog assignment patterns (`'{a: 1'b1}`). The target reports BLOCKED (exit 2) and the Makefile maps that to a pass with the words \"BLOCKED (tool limitation), not a design failure\". No synthesis of the design is therefore performed by the gate.",
      "spec_clause": "No ISA clause applies: synthesis is a physical-feasibility check, not an architectural one.",
      "alternative_verification": {
        "status": "open",
        "cases": [],
        "checks": [],
        "note": "Nothing synthesises the whole design. tools/lint_rtl.py and slang-tidy parse and type-check the same source, which is a weaker property (no netlist is produced)."
      },
      "affected_cases": [],
      "affected_scope": "Makefile synth-generic target; tools/synth_check.py; rtl/**",
      "end_condition": "A synthesis flow that parses the assignment patterns the RTL uses (a newer Yosys, or the patterns rewritten) runs and `make synth-generic` exits 0 without the BLOCKED mapping."
    },
    {
      "id": "EX-004",
      "kind": "disabled_checker",
      "subjects": [
        "markdown under results/ and tests/ excluded from the docs/verification.md planning inventory"
      ],
      "reason": "The plan document's own embedded checker asserts that the repository's markdown is exactly the planning inventory. Implementation evidence has since been written under results/ and tests/, so the wrapper applies one declared deviation: those prefixes are removed from the inventory before the embedded checker runs.",
      "spec_clause": "No ISA clause applies: docs/verification.md is a planning-document contract, not a specification requirement.",
      "alternative_verification": {
        "status": "covered",
        "cases": [],
        "checks": [
          "tools/check_records.py",
          "tools/check_docs.py"
        ],
        "note": "Every other check in docs/verification.md runs unmodified, and tools/check_records.py independently requires that every report a delivered package names exists on disk. The deviation is printed on every run rather than implied."
      },
      "affected_cases": [],
      "affected_scope": "tools/check_docs.py; docs/verification.md; results/**/*.md; tests/**/*.md",
      "end_condition": "The planning inventory statement in docs/verification.md is updated to admit implementation evidence as a separate category, so no deviation is needed."
    },
    {
      "id": "EX-005",
      "kind": "skip",
      "subjects": [
        "ACT4 D",
        "ACT4 F",
        "ACT4 ZfaD",
        "ACT4 ZfaF",
        "ACT4 ZfaZfh",
        "ACT4 ZfaZfhD",
        "ACT4 ZfaZvfh",
        "ACT4 Zfbfmin",
        "ACT4 Zfh",
        "ACT4 ZfhD",
        "ACT4 Zfhmin",
        "ACT4 ZfhminD"
      ],
      "reason": "The p0 bring-up core has no floating-point unit, so the F/D ACT4 ELFs cannot execute on it. tools/run_act_dut.py records every deferred suite with its reason in suite_manifest.json rather than silently dropping it.",
      "spec_clause": "RISC-V ISA manual, F/D extension chapters (floating-point registers and operations).",
      "alternative_verification": {
        "status": "covered",
        "cases": [
          "fp.operation_matrix"
        ],
        "checks": [
          "tools/check_capability_matrix.py"
        ],
        "note": "F/D is not advertised by any delivered profile (capability_ladder min_profile p2 and I-050 is undelivered), so no committed capability rests on this skip. fp.operation_matrix verifies the FPU unit that exists."
      },
      "affected_cases": [
        {
          "case": "core.bringup_vs_reference",
          "fields": [
            "act4_suites"
          ]
        }
      ],
      "affected_scope": "tools/run_act_dut.py; config/capability/models.json (act4)",
      "end_condition": "A profile that claims F/D has its ACT4 suites generated and executed on a DUT, and the suite manifest lists no deferred F/D suite."
    },
    {
      "id": "EX-006",
      "kind": "skip",
      "subjects": [
        "ACT4 Zaamo",
        "ACT4 Zabha",
        "ACT4 Zacas",
        "ACT4 ZacasZabha",
        "ACT4 Zalrsc",
        "ACT4 Ziccamoa",
        "ACT4 Ziccamoc"
      ],
      "reason": "The ACT4 runner executes only the p0 applicable suites I/M/Zicsr/Zifencei. The A-extension suites are deferred because p0 does not claim A.",
      "spec_clause": "RISC-V ISA manual, A extension (atomic memory operations and LR/SC).",
      "alternative_verification": {
        "status": "covered",
        "cases": [
          "amo.linearization",
          "lrsc.reservation_progress"
        ],
        "checks": [],